{
  "schema_version": 1,
  "evidence_id": "ev-fastokens-pinned-v1",
  "generated_by": {
    "tool": "tools/generate_evidence.py",
    "tool_version": "1.1.0",
    "source_commit": "d525461c5a16f5a640904f82dd3a4eca67e79f0c",
    "generated_at": "2026-08-27T08:03:51Z"
  },
  "run": {
    "run_id": "fastokens-pinned-differential-campaign",
    "date": "2026-08-20",
    "suite_version": "fastokens-pinned-differential-v1"
  },
  "oracle": {
    "package": "tokenizers",
    "version": "0.22.2"
  },
  "artifacts": [
    {
      "artifact_sha256": "621ac2e32d0dba658404412318818aaa8ce8cda492e59830109d8da6b517fb41",
      "family": "deepseek_v3"
    },
    {
      "artifact_sha256": "8f9f37ca37fdc4f5fd36d5cf4d3b0e8392edb4e894fd10cc0d70b4957c8633cf",
      "family": "deepseek_v4_flash"
    },
    {
      "artifact_sha256": "19e773648cb4e65de8660ea6365e10acca112d42a854923df93db4a6f333a82d",
      "family": "glm_5_2"
    },
    {
      "artifact_sha256": "0614fe83cadab421296e664e1f48f4261fa8fef6e03e63bb75c20f38e37d07d3",
      "family": "gpt_oss_120b"
    },
    {
      "artifact_sha256": "446e0b59cd941637c0ddfd84e12ee1f49480fd12097f86a9d2fec8ebd0c7ff6c",
      "family": "hy3"
    },
    {
      "artifact_sha256": "773c2476259d9e092bba48d1f4840aaf584fa87cd5083a7e33b54d6d6f9feb77",
      "family": "kimi_k3"
    },
    {
      "artifact_sha256": "809240f7a182cde859a4fc4ebc902e619a173d507e99304c1092aa04e7a6658e",
      "family": "laguna_s_2_1"
    },
    {
      "artifact_sha256": "40fb9d7d7795b8bd305aeff39ce9963f3f450915b9553f2938e009be9a1fed60",
      "family": "ling_3_0_flash"
    },
    {
      "artifact_sha256": "76e48799b099d43365bd24ccd8ecc5aedac831718da780552f03b0a6eb4412aa",
      "family": "llama_3_1_8b"
    },
    {
      "artifact_sha256": "bb1f1626cf01448f1e3b6036d0a061ffc66c91d9046aada14ea23a5441b5ad6e",
      "family": "minimax_m3"
    },
    {
      "artifact_sha256": "d5f6046775b112f0e2d456ee9dba450684ab964fe5c4e231599bdc6773028135",
      "family": "ministral_3_8b"
    },
    {
      "artifact_sha256": "623c34567aebb18582765289fbe23d901c62704d6518d71866e0e58db892b5b7",
      "family": "nemotron_3_nano_4b"
    },
    {
      "artifact_sha256": "73fd5254624f39a88e3faac6a8e11300fc3c735ed37880d4f4f08db898eaecca",
      "family": "olmo_3_7b"
    },
    {
      "artifact_sha256": "5f9e4d4901a92b997e463c1f46055088b6cca5ca61a6522d1b9f64c4bb81cb42",
      "family": "qwen3_5_08b"
    },
    {
      "artifact_sha256": "aeb13307a71acd8fe81861d94ad54ab689df773318809eed3cbe794b4492dae4",
      "family": "qwen3_8b"
    }
  ],
  "corpora": [
    {
      "corpus_id": "nvidia/Nemotron-CC-v2.1@ba6f2aaef7ada865bb08fc08640ca292150097db",
      "docs": 998857881,
      "bytes": 3247759706137
    }
  ],
  "totals": {
    "docs": 998857881,
    "bytes": 3247759706137,
    "mismatches": 0,
    "routed": 505
  },
  "environment": {
    "os": "Linux x86_64 (Rocky Linux 8.10, SOL htc compute nodes)",
    "python": "3.13.13"
  },
  "root_digest": "sha256:ac65a3579b927dd0348462bab3ae46c5e8d229cfe26afa74537e12cf4cfcca12"
}
